{
  "schema": "python-slm-p0a-phase-acceptance-v1",
  "phase_id": "P0A",
  "interface_id": "portable-interface-v2",
  "profile_id": "prototype-windows-5090-v1",
  "sequence": 1,
  "status": "PASS",
  "acceptance_kind": "owner_approved_contract_amendment",
  "run_path": "runs/20260813T111427138Z-594485fab70714426a7a3870",
  "run_evidence_sha256": "c9de84843e74771fa675514f552301757b8fbadb2ea16e7afa13a0b4c40e2cd1",
  "seal_path": "runs/20260813T111427138Z-594485fab70714426a7a3870/SHA256SUMS",
  "seal_sha256": "5248bbd6ef45e42480676a978a683a8883e68466804b0cce572af6b368044900",
  "approvals": [
    {
      "role": "technical",
      "decision": "APPROVE",
      "path": "approvals/technical-00000003.json",
      "sha256": "ea9eae24d1763e8ac257a35b63f6df3648bc5ed7cb7199863d6161b3142a9765"
    },
    {
      "role": "data_governance",
      "decision": "APPROVE",
      "path": "approvals/data-governance-00000003.json",
      "sha256": "8273e1fb6fb8aa812253f825dd38632770fa43ed4f8246907be622bf0b0783a3"
    }
  ],
  "approval_commit": "3b36781ea5cc4eb6316249d6c2fc342c61ef220e",
  "preapproval_commit": "f49abcca7f0b110759606c0bf9beffc911cc6635",
  "todo_preapproval_sha256": "edf293b4001915955d8865ffa9b8b45153a460be252b9ecde17945225985075d",
  "previous_acceptance_sha256": null,
  "created_at": "2026-08-13T11:59:08.863780800Z"
}
